Index,Text
8,들으시구나 그래서 그렇게 저렇게 제의 일부 일만 먼저 상환 하시면 저희 에서 어느 정도 들어가야 되니까 이런 면접 구해 보시 라고 그다음 한번 진행 보겠다고 그렇게 말씀 하셨거든요 그러시구나 지금 상황 에선 다른 방법 없어요 고객 결론 으로 지금 부채 지금 원래 정도 정도 에요 구백 하면 정도 되시는데 지금 부채 너무 많다는 얘기 예요 그리고 부채 일부 지금 상환 하셨고 그래서 지금 원도 남아 있는데 지금 등록 지금 리드 코프 밖에 등록 했어요 그러다 니까 지금 지금 추가 부채 나오는 상황 이라 이런 상황 에는 부채 일부러 상환 하셔야 돼요 부채 초과 됐으면 상관 없습니다 저희 에서 바로 고인 으로 입금 드리면은 고객 께서 받고 나서 이제 정리 하시면 되는데 이미 부채 초과 됐기 이렇게 진행 하시는 예요
9,부채 됐으면 상관 없습니다 그냥 대출 자금 받아 가시 되는 예요 그리고 이제 만약 이제 고객 께서 이번 지금 진행 하면 혹시 대출 받을 혹시 전화번호 가지 계십니까
10,마네
11,전화번호 어떻게 되십니까 그니까 대출 받으셨잖아요 받을 어디 에서 어느 지점 에서 받으신
12,아유 정말 책임 만도 없어야 거지 바로 나왔기 밀기여
13,여보세요 어느 지점 에서 받으신 니까
14,지점 모르겠고요 전화번호 어떻게 되습니까 그럼 지점 확인 드릴게요
15,잠시 지점 한번 확인 드릴게요 지점 이네 중구 지점 일단 지금 상황 에서 고객 께서 솔직히 그래요 저희 대출 자금 내보내 드리면 저희 좋고 이제 고객 께선 받아도 좋겠지만은 지금 부채 초과 나오는 이상은 지금 제출 자금 저희 내보내 드리면 불법 제출 되기 저희 부라 넣어 드릴 수가 없어요 그러기 초과 처리 되면 정상 대출 진행 가능하시니까 저희 그렇게 진행 밖에 없는 상황 이라 일단 께서 힘들지만은 생각 보시 만약 진행 가능하시다고 하면 연락 한번 주세요 죄송하지만 저희 지원이 착오 있는
16,아니요 차도 요가 지금 하고 장난 아니고 처음 부터 부가세 나서 된다고 그랬더니 그러면 부가세 여기 하고 상관 없으니까 상관 없으니까 그쳐요 가능합니다라고 한테 말씀 해주셨거든요
17,담당 께서 그걸 이제 세금 부분 이제 착각 하신 같은데 세금 납품 으로 나오시니까 부채 소화 포함 되십니다 고거 착각 하신 왜냐면 세금 대출 자금 하고 대출 대출 이고 세금 세금 인데 부채 이렇게 통합 하신 그러다 니까 고런 착오 있는 같은데 어떻게 죄송한 마음 있는데 저희 어겨 가면 제출 진행 없는 아니에요 없어다 죄송하고요 일단 고객 생각 보시 진행 가능하시면 먼저 연락 주세요 서류 준비 해서 이렇게 진행 드리겠습니다 알겠습니다
1,고객 맞으시죠 아하 심사 결과 안내 연락 드렸는데 우선 대출 에서는 지금 그래서 이렇게 대출 받아 보셨지만 최근 까지 연체 이력 없으 카드 금융 카드 이용 중이 잖아요 부분 연체 없이도 무량 하게 사용 하시고 신용 거래 오래 주신 저희 국민은행 에서 굉장히 긍정 으로 평가 하세요 근데 반면 아무래도 대출 에서 이용 하시는데 보험사 금융 이세 그래서 전산 금융 거래 실적 미비하시다 라곤 하는데요 다행히도 상환 능력 평가 미달 부결 나신 라서 상환 능력 평가 확인 되시면 좋은 조건 으로 발급 가능하시다 확인 되시니까 아무래도 다음 부터 이제 으로 진급 심사 있어요
2,어디 대리 어디 대리점
3,라고 하셨죠 대리점 아니고 여의도 본세요 여의도 본사 본점 이시고 아무래도 다음 중요한 심사 있으니까 고객 이렇게 따로 이렇게 좋은 조건 으로 발급 되시면은 실적 많이 올라가는 사실 이라서 예외 심사 으로 편법 이지만 상환 능력 평가 따로 있게끔 접수 접수 한번 드리고 싶은데 고객 혹시 마이너스 통장 많이 필요하신지 해서요
4,개반 능력 평가 어떤 건가
5,상환 능력 평가 라는 국민은행 에서 자금 나갔을 고객 께서 상환 있는지 확인 하는 거고요
6,그럼 어떻게 건가
7,우선 가지 방법 있어요 우선 번째 방법 완납 거나 이상 상환 되면 고객 자금 이상 있다 라는 증빙 되니까 저희 마이너스 통장 한도 까지 발급 되는 거고
8,먼저 보내야 된다고요
9,번째 방법 그렇구요 여유 자금 없으시면은 번째 방법 으로 진행 하셔야 되는데 아무래도 카드 사도 많이 이용 하시잖아요 에서 자금 받으시면은 저희 국민은행 전산 확인 되고 자금 받으신 카드 다시 완납 하면 상환 기록 들어 남잖아요
10,닭글 하나 들어
11,드리면은 롯데 카드 현대 카드 현대 카드 에서 받으셨어요 오늘 그러면은 국민은행 에서 현대 카드 에서 이렇게 받았다 확인 되시잖아요 받으시고 내일 다시 카드 완납 처리 하면은 대한 상환 기록 남죠 그래서 하루 이자 저희 국민은행 에서 납부 드려야 현대 카드 에서 거래 실적 보내 주시 니까 아무래도 고객 입장 에서 받았다가 다음 완납 하는 라서 사이 고객 자금 부족하지 않은 이다 이렇게 전산 하고 서류 남겨 놔야 마이너스 통장 승인 처리 내어 드릴 수가 있으니까 아무래도 약간 편법 있다 말씀 이신 가요 그게 카드 같은 받으라는 말씀 이신 가요 그렇죠 받았다가 다음 완납 하시는 거고
12,카드 결제 그렇게 나누는지를 모르겠는데
13,결제 하시죠 카드 사는 모두 결제 있는 거고 거치 기간 이라는 있잖아요 카드 사는 거치 기간 이라는 있는데 저희 국민은행 금융 이고 카드 사는 금융 이세 그러다 니까 국민은행 에서 이자 납부 요청 하면 완납 처리 국민은행 에서 이렇게 요청 해서 고객 카드 다시 완납 하면 되는 니까
14,부분 대해 거치 있어 받아서 다음 다시 그냥 갚으라는
15,그렇죠 전산 하고 서류 남겨 놓기 위해 그런 거구 이렇게 해야 되냐면 지금 금융 거래 실적 없다는 잖아요 전산 에서 거래 실적 없다는 한마디 그냥 고객 자금 부족하다 판단 돼서 부결 거란 이에요 그래서 전산 에로 이제 대출 에서 고객 자금 있다는 증빙 해야 돼서 우선 전산 하고 서류 남겨 놓는 거고 고객 이렇게 자금 부족하지 않은 이다 이렇게 남겨놓고 승인 처리 내어 드릴려고 하는 거고 지금 상황 에서 그때 말씀드렸던 프로 있잖아요 그냥 승인 처리 드릴 수가 있어요 그냥 승인 처리 냈다가 감사 에서 와서 지금 서류 전산 아무 없는데 이렇게 발급 줬냐 하면 없는 사실 이어서 받으셨다가 다음 완납 하신 기록 이렇게 확인 하고 승인 처리 드릴려고 하는 거구 금액 만큼 한도 측정 되시니까 아무래도 최대한 도로 받으셨다가 어차피 완납 하는 최대한 도로 받으셨다가 완납 하시는 기도 하고 입장 으로
16,봤을 아무래도 한도 높게서 설정 드려야 실청 많이 올라가는 있어서 과장 한테 우선 친척 관계 된다고 말씀 드려 놓을 예요 그래야지 국민 행행 에서 이자 납부 드리고 하는 부분 있어서 하시니까 아무래도 이렇게 친척 형님 신다 말씀드릴 거고 년생 이니까 과장 한테 말씀드리고 니까 고객 주셔야 그럼 여유 자금 있으시다면 이상 상환 하시는 거나 카드 에서 이상 자금 받으셨다가 다음 완납 하신 이력 가지 똑같으세요
17,
18,받으셨던 지금 까지 쓰고 있다가 완납 하는 거나 오늘 카드 에서 자금 받아서 내일 완납 하는 거나 어차피 똑같은 라서 아무래도 기간 다를 이지 서류 으로 남겨놓을 문제 없으시다 말씀드리는 거구 그래서 편법 이라고 말씀드리는 예요 카드 한도 계시나요 카드 이나 현금 서비스
19,그건 전화해서 확인 가야 같은데
20,그렇죠 하시고 서류 남겨 놔야 되고 이자 납부 해드려야 된다 그랬죠 하루 하루 이자 납부 드리려면 금리 엄청 중요해요 평점 프로 그러면 오육 까지 메모 하셔서 한테 전달 주시 되세요
21,알겠습니다 여의도 본사 라고 하셨죠
22,기도 이시고 지금 정식 절차 아니고 편법 으로 진행 하는 건데 이렇게 금융 직원 이렇게 도와주고 있다 이렇게 보완 유지 주세요 도와주고 있다고 하면 감사 에서 한테 바로 수도 있으니까
23,부분 조심해 주시면요 담당자 성함 한태수 대리 입니다
24,한태수 집품 번호 있잖아요 전화 드린 번호 한태수 대리 저장 주시구요 한동 하려고요 한도 금리 파악 하시고 저희 직통 번호 전화해서 한태수 대리 빨리 하도 하고 싶으시면은 대리 친척 형님 신다고 하면
25,집말 연결해 주실 거고요
26,상담 분들 바쁠 가끔 받을 있으니까 확인 하고 연락 드리겠습니다
27,알겠습니다 알겠습니다 고객 과장 한테 가서 말씀드리고
28,알겠습니다
29,PC
1,잘못 들어 갖고 그거 지금 전화하셔가지고 이제 반환 신청 하시면은 까지 하시면은 되시거든요 당국 자거자 적거 다음 다시 진행 다시 처음 부터 다시 드릴게요
2,어떻게 했는지 지금 설명 주세요 그러면 지금 하나님 에다가 수선 할게요 그다음
3,화장 그리고 저희 지금 온라인 으로 있으신 혹시 캐피탈 삭제 하셨나요 그거 그러면 데이터 꺼놓으셨나요 온라인 으로 이제 있으셔야지 저희 이제 실시간 으로 이제 드릴 있는 부분 인데 지금 오프라인 으로 있으세요 다시 연결 한번 주셔야 되거든요
4,아세요 그러면 에서도 에다가 이용 주시 거고 하나 에다가 일부러 납부 하는 건가
5,일단 늦기 산악 저가 반환 신청 먼저 하시는 일단 순위 그거 되게 급한 문제 거든요 그게 같은 밖에 돼가지고
6,잡아야 되면 좋은 공간 예요 편하게 근데 저희 이제
7,사관 해야 되는데 혼자 납부 수도 하셨잖아요 그래서 거기 문제 생기는 건데 지금 이제 저희 이제 통화 해봤자 지금 바뀌는 없어요 그래서 지금 반환 신청 하셔 하신 다음 다시 얘기 하는 그럼 에서 어느 정도 상환 주시 예요 저희 아까 말씀드렸듯이 조금 이라도 금액 들어가야 돼요 아니까 저희 그니까 저희 에서도 이제 납부 이제 같이 하는 조건 으로 하는 거든요
8,그러니까 에다가 납부 하는 예요 아니면 산나 으로 납부 하는 예요
9,상하 으로 납부 하시구요 저희 나머지 금액 같이 납부 해야지 그게 인정이 되시는 부분 이라서
10,에서 친안에서 산하요
11,일단 일단 반환 신청 먼저 하시고 반환 신청 받으시면은 다시 공문 협조 보낼게요 그다음 이제 같이 진행 이렇게 해야 돼요 저희 이제 얼마 넣고 에서도 고객 이제
12,미팅 하십니다
13,일단 반환 처리 하시고 바로 연락 다시 주세요
1,바로 잡아 드릴겠 는데 주민 번호 지금 부터 눕취 시작 하겠습니다 주민 번호 불러주세요 시구 저희 롱플레너 방문 이나 등기우편 받으실 주소 불러주세요
2,등기 받아 주세요
3,저희 출금 받아 보실 계좌 번호 불러주세요 농협 은행 요구 지수 맞으시죠 농협 은행 이시고 그리고 맞으시구요 저희 상관 하실 날짜 결정 주시겠어요 단위 가능하십니다
4,오히려
5,일이 일로 잡히셨구요 고객 대수 대해 인지세 복원 발생 되셔야 돼요
6,그거 얘기 들었네
7,고객 설명 드릴게요 같은 경우 에는 고객 께서 저희 으로 주셔야 대출 나가시 아니시구요 대출 나가실 제외 되고 나가신 아니세요 쉽게 설명 해서 고객 께서 부담 하신 금액 없으시구요 금융 대신 고객 한테 대출 내어 드리기 위해 책임 신고 처리 하는 건데 고객 명의 신고 처리 하는 부분 고객 동의 하는 예요 동의 하십니까
8,아래
9,러시 신고 처리 드릴게요 잠시 신고 처리 드렸구요 마니아 저희 에서 대출 나가시 상황 발생 되시면은 인지세 부분 같은 경우 에는 부결 접수 올려서 환급 절차 진행 되시면 문제 되시는 부분 전혀 없어요 시구 그리고 승인 나신 잠시 지금 정도 되셨는데 늦어도 까지 송금 처리 완료 되실 예요 그때 농협 으로 잔액 확인 보시 되시구요 자금 같은 경우 에는 프로 게요 승인 처리 나셨고요 삼성 이건 이었습니다
10,달라졌네요 저희 승인 나신 자금 승인 처리 나셨거든요 이요
11,프로 개월 승인 처리 나셨고요 삼성 저축은행 통금 이건 이었습니다 알겠습니다 감사합니다
1,걱정 하셔도 되고 어디 신용등급 하락 이라는 이내 대출 계약 회로 상호 출을 하시는 거기 등기 되는 문제 되시니까
2,그럼 대출 받을 얘기 가지 이렇게 하면 되는
3,아니죠 대출 받을 이렇게 얘기 하면 되죠 고객
4,
5,대출 받을 당연히 대충 상환 처리 라고 받는 이렇게 얘기 하면 되는 거고요 그렇게 되면은 이제 의적 으로 편법 으로 대출 진행 한다는 대해 에서 인내 안내 드리거나 저희 에서 승인 불가능하세요 그러니까 대출 받을 무슨 정부 상품 받기 위해 잠깐 하는 이렇게 말씀 하시면 됩니다
6,그럼 빌리면 가지 저기 웰컴 저축은행 하고 그냥 납부 하면 되는 예요 어떻게 되냐
7,회원 아까 말씀드렸 시피 공문 노통 되시면 한테 전화 주시 돼요
8,그러면 어때 거기 직접 이렇게 주는 예요
9,공문 접수 하면요 에서 고객 한테 확인 전가 들어오신다고요 고객
10,아베 전화 오고 그러면 지점 가지
11,국민 기장 다시 설명 드리겠습니다 일단 고객 께서 그냥 상황 알아서 하시게 되시면은 들어서 자금 융통 하시고 저희 본문 접수 하고 바로 상환 처리 하시게 되면은 신용 상환 대출 입니다 그렇기 고객 전산 저희 으로 되지 않기 대출 불가능하시구요 고객 상환 처리 하실 저희 한테 미리 말씀 주셔야지 저축 이라든지 캐피탈 금융 에다가 공문 접수 접수 내용 고객 대한 용품 이나 자료 이런 도이트 조정 해서 저희 으로 넘겨 달라 이런 공문 내용 입니다 공문 내용 고객 께서 동의 주시 전화 일단 받아주셔야지만 전산 자료 저희 으로 넘어오기 공공 접수 하고 하고 나서 고객 상환 처리 하시고 나서 그다음 저희 대출 나가는 예요 그렇게 되면 최종 승인 나오시면은 고객 원하시는 지점 으로 그때 연결 시켜 드립니다
12,그래요 원하는 지점 알아서
13,고객 그니까 동네 어디 동네 편하시겠다 말씀 하시면 동네 가까운 지점 으로 저희 연결 시켜 드리는 예요
14,상환 인장 먼저 하고 다음 이제 그거 하는 거구 은행 가서 해야 되는 거구 은행 가서 상하
15,상환 처리 하셔야지만 전산 자료 넘어오기 전산 자료 토대 저희 대출 궁금해서 그러는데 그럼 상환 직접 저기 저축 해다가 하는 고객 께서 하시는 고객
16,괜히 중간 다가 입죠하고라 거기 직접 하시는 당연히래요 지금 저희 여의도 그거 그랬어
17,동등 여의도동 번지 같이
18,일단 지금 이리저리 얘기 해놨으니까 그거 대해 알겠습니다 내일 전화 주면 한번 알아볼게요 알겠습니다 알겠습니다
1,다시
2,에서는 정도 고객 본인 융통 되시면은 나머지 저희 원금 통해 같이 상환 천리 하시는 도움 드릴 수도 있으세요
3,근데 지금 거의 사정 어렵습니다 되시는 거고
4,그럼 조그만 소액 이라도 일단 고객 께서 환불 처리 하신다 생각 하지 마시고 금액 융통 되시면은 한테 미리 말씀 번만 주시세요 왜냐면 원금 얼마 나갈 있는지는 확인 해보면은 많이 받아 있는 부분 있기 그렇게 진행 도움 드리겠습니다
5,그래요 소액 으로도 소액 하면은 어떻게 한다는
6,일단 저희 연금 통해 일단 완납 처리 되셔야지만 전산 이란 저희 가치
7,내면
8,고객 께서 들어서 웰컴 저축 운행 안내 정도 본인 상환 찰를 하셨다 만약 남으셨잖아요 그럼 저희 지연 금은 나가야 된다는 얘기 잖아요 그렇게 되면은 저희 정도 까지 대출 승인 내어 수가 있단 얘기
9,이해 되는데
10,쉽게 설명 하면은 저희 원금 만약 나갔으니까 고객 받아 보신 받아 보시 이나 받아 보시 되죠 저희 출금
11,
12,말씀드렸는 어느 정도 금액 이라도 배송 자금 되시면은 연금 드릴 있는지 없는지 여부 한번 심작 과장 여쭤 니까 한테 말씀 미리 하시란 얘기 그렇게 되면 진행 사항 말씀드린단 얘기 입니다
13,알겠습니다 아직 끝났
1,여보세요
2,박경호 랜드 기억나시나요 여보세요 들리세요 경우 이에요 기억나시죠 어제 혹시 저희 마감 에나 은행 에서 따로 전화 받아 보신 있으세요
3,아니야
4,없으시구요 일단 저희 문서 해서 저희 프로그램 택배
5,핸드폰 이상해서 다트 다시 이렇게 처음 부터 초기 시켰거든요 러신 예요 자꾸 이제 꺼져가지고 진짜 오랜
6,지금 애플 설명 드렸네요 저희 프로그램 같은 경우 에는 삭제 시켜 버리면요 기존 갖고 있던 신청서 삭제 버리거든요
7,지금 저희 날짜 해서 대출 신청서 작성 주셔야 같은데요
8,지금 카카오 으로 그때 저희 KB 큐피탈 홈페이지 링크 하나 보내 드릴게요 잠시 지금 전화 통화 하면서 같이 대출 신청서 하나 작성 부착 부탁 드릴게요 근데 버스 안이 라서 내려서 다시 전화 드릴게요 정도 걸리실까
9,이제 내릴 예요 근데 지금 내릴 기민 내릴려면 그래서
10,그러면 그럼 전화 해서요 찾는다고 부탁 드리고
11,나도 봐라 도리
12,원동 주식 센터 입니다
13,다음 주의
1,관심 있으신 거구
2,관심 다기 보다 문자 문자 들어와서 전화 드리는데
3,
4,니까 같은 경우 에는 지금 내용 니까 개인 해진 중이 사장
5,랑은 상관없고 계좌 사용 가능하시잖아 그래드 사장 회생 연체 가이고 이런 아니잖아요
6,그런 있으면 되죠 여기 있는 그러면 이제 남기죠
7,맞아 그런 랑은 상관없어요 크게 사장
8,근데 니까 주신 내용 대로 그대로 주시 니까
9,사용 하루 이고 시불 아니고서 그냥 하루하루 들어가시는 예요 저희
10,하루하루 이렇게 걸려 온다고요
11,일주일 까지는 매일 들어가구요 일주일 지나고 그다음 부터는 저희 주치 선불 넣어 드려요 그러면은 과거 에는 일시 불로 넣어 드렸는데 그러다 니까 받고 연락 되시는 분들 계시더라구요 그래서 처음 에는 매일 들어가시고 일주일 경과 되면 그다음 들어가시 처음 에는 매일 돌아다다 인제 들어 다니죠
12,
13,들어가고 경과 하시면은 저희 최대 개월 까지 인데 번째 진행 하시면은 둘째 셋째 이렇게 넣어 드리고 순차 으로 처음 부터는 드리고 그렇게 진행 되세요
14,그리고 합자 저기 서예 지는 지금 거기 거기 무슨 회사 니까
15,회사 맞아요 사장
16,회사 에서 이렇게 세부 부터 그런 부분 이렇게 통장 해가지고 작게 려고 그렇게
17,드리 세금 보다 적게 나오니까 이만 드리는 거구
18,통장 통장 어느 거나 상관 운동 입니다
19,아니요 국민 기업 농협 제외 하고요 사장
20,국민 농약 기업 해야 한다고요
21,예산 어느 차라리
22,오느 은행 가서로 우체국 많이 쓰고요 예전 우체국 많이 쓰고 그다음 저기 어디 여왕 이면 의료
23,우리은행 있으세요 우체국 우리은행 이기 이용 하세요 최근 까지 사용 하셨던 건가 사장 계속 사용 하시는 건가 사장
24,근데 사실 당구 없었어요 왜냐하면 인자 인생 이기도
25,상고 없어도 상관없는 거구 그럼 보내주시는 맞는 거고 휴면 계좌 촬영 계속 했던 아니면 계속 따른 거기 빠지고 나가고 입출금
26,맡고 개제 이제 가정 지금 이야기 선수 그러다 니까 알다시피 신용 불류을 개인 가다 보면은 전용 그래가 그렇게 좋을 없지 않습니까 니까 중장 해다가 우체국 통장 해가지고 직화 해가지고 그냥
27,체크 노직켓 사용 하는
28,그러냐 신용카드 자체 발급 되잖아요
29,그니까 우체국 같은 경우 체크카드 계속 사용 하셨던 거구 그니까 우리은행 말씀 하신 다른 우리은행 체크카드 사용 하셨던 건가 사장
30,아니요 은행 가지 안잖 왜냐면 은행 많이 없잖아요 그러다 니까 창원 거든요 우체국 동네 우체국 많고 우체국 여러 군데 있는데 은행 카드 현재 우리은행 없으신 예요 사장 우리은행 카드 말입 니까
31,체크카드
32,체크카드 없어요 동양 있는데 그러면 체크카드 발급 받아 내면 되는 아니가
33,그럼 외환 은하 있다고 하지 않으셨어요
34,언니
35,우리은행 사용 하신 얼마나 되셨어요 통장 우리은행
36,통장 통장 거래 한지 되는데요
37,얼마나 되셨죠
38,되지요
39,아마 해지 돼서 아마 재발 받으셔야 예요 신규
40,신기로 예약 제각 받나 그때 인도 쓰겠네
41,끊었으면 휴면 계좌 잡혀 있으니까 카드 발급 받으시거나 만약 휴면 계좌 해서 해지 됐다고 하면은 재발 하나 받으시면 되시고 만약 사장 께서 하실 그렇게 은행 가셔서 신규 다른 하나 발급 받으시면 되시고 하시겠다고 하시면 우체국 진행 하셔도 되시구요
42,그니까 지금 까지 쓰고 있으니까 그래 갖고 항상 제크 카드 냉금 매놓고 써야 되니까 그거 그거 하고 크게 거래 일이 있어서 되니까
43,우리은행 이나 아무 가까운 은행 있으시면 신규 발급 받으시면 되세요 사장
44,엄청 먹고 옛날 쓰던 통장 있긴 있는데 그거
45,있어야 돼요 사장 카드
46,갔어요
47,내고 사용 우리은행 하셨기 그니까 입출금 한도 기본 이에요 사장 근데 사용 오랫동안 하시면 그게 한도 으로 줄어요 사장
48,운행 가봤을까 확인 봐야 그냥
49,하고 입출금 한도 입출금 한도 기본 한도 으로 올려 달라 말씀 하셔야 돼요 한도 한도 기본 그걸 올려 달라 사용 하다가 카드 만들러 왔는데 한도 요즘 준다는 이야기 있는데 사용 하면은 기본 한도 얼마나 있냐 그래서 러시 다시 사용 니까 정상 으로 기본 한도 으로 올려 달라 말씀 하시면 올려주실 예요 만약 해지 돼서 다시 발급 받아야 됩니다 하면은 은행 에서 신규 발급 받으셔도 되시는데 지금 은행 에서 통장 발급 받기가 이렇게 쉽진 않아요 그니까 들어서 우리은행 갔는데 통장 발급 수도 있어요 사장 카드 그러면은 다른 은행 가보시면 되세요 그거 은행 마다 차이 있기
50,개인 회견 중이 은행 통장 하고 이런 발급 하는 아무 지장 없던데
51,신용 불량 회생 아니셔 사장 통장 받는 발급 받는데 요즘 물어보고 하는 경우 있어요 하신다게 은행 직접 보셔야 돼요 어떻 드릴 수가 없어요 은행 직접 보셔야지 말씀
52,계산 하는 있었는데 아까 말씀 대로 거래 하다 니까 사용 하죠 없고 그니까 체크카드 발급 받으시고 확인 하시고실기 그러면
53,일단 은행 가셨다가 확인 하고 연락 주세요 사장 그게 제일 빨라요
54,그럼 지금 말씀 대로 하루 얘기 하면 없나요
55,이요 아니면은 그냥 우체국 있으시면 우체국 그냥 진행 하셔도 되시는데 잠깐 만국 외출 많이 쓰고요 항상 가지 다니면서 써야 되니까 우체국 보내 주시 사장 께서 신규 하나 발급 받으셔도 되시고 다른 편한 대로 하시면
56,만들라 이이
57,신규 발급 돼요 지금 사장 신규 여부 요즘 우체국 우체국 같은 경우
58,어니이 가서 라면 통장 가져가 갖고
59,아무 은행 이나 상관 없어요 사장 국민 기업 농협 우체국 빼고는요
60,은행 가서 그러면 통장 지금 있는 통장 가지 훈경 계장 아닌가 확인 해봐야 되겠네요
61,가셔서 아까 말씀드린 대로 고거 확인 보시 만약 우리은행 아니고 다른 은행 이래도 신규 신규 발급 받는 무조건 기본 한도 으로 있어요 사장
62,하루 체리 있는
63,주체 아니구 요도 출금 한도
64,재한 카드 그래 대라고요
65,입체 한도 아니고요 출금 한도 기본 이어서 잖아요
66,하루 죽음 있는 한도 일만
