Index,Text
3,하나 하나 하나 하나요 BNK 먼저 납부 하실 건데 고객 납부 하실 산이 요청 해달라고 이제 요청 보내놨거든요 고객 아시 지인 이다 인제 비행기 상환 하시고 이번 늦게 가지 인척 관계 인데 가지 에서 대출 잘못 받은 같다 에서 줄려고 하는데 이렇게 근데 에서 이제 대출 저희 에서 이제 대출 한다고 얘기 하구요 인제 등급 관리 다음 이렇게 인제 관리 해드린다고 했거든요 이제 고객 저희 대출 해준다고 하면 고객 뺏기는 상환 받아줘요 그래서 저희 이제 우회 방법 으로는 전산 받아야 하는데 전산 관를 주면은 아무 말짱 소용 없는 지금 하시는 방법 그런 거든요 채권 해류 에서 뭐라고 하더라도 전화 하시면 혹시 에서 대출 받으려고 하냐고 물어보면 절대 아니다고 말씀 주세요
4,주시구요 인제 담당자 배정 되면은 이제 바로 이제 납부 인제 하실 있게끔 예요 그러면 했었다고 이제 전화 주시 빨리 전산 위반 요청 하고 빨리 해달라고 오늘 내일 금요일 잖아요 고객 그로 해서 오늘 자금 받으시는 좋을
5,저기 잠시 정리 볼게요 그럼 먼저 가게 전화해가지고 전산 기간 요청 다음 그게 되면 이제 집어넣는니다
6,그러니까 에서 수도 있어요 요즘 요렇게 우회 방법 많이 하기 염초 인제 구정 이기 인제 아시 지인 이나 요렇게 인제 대출 많이 받아가거든요
7,오케이
8,일단 금액 금액 잖아요 자리 빼고 원만 저희 납부 이자 있잖아요 이자 저희 에서 이렇게 주기 했거든요 이렇게 줘야 에서도 긍정 으로 생각 거든요 그래 가지 인제 인제 에서 인제 저희 으로 청구 예요 고객 납부 하시면 원만 납부 주시 돼요 알려 드릴 예요 고객
9,통문 확인 했다고 하면요 알겠습니다 하고 전화 드리면 되죠
10,하구요 에다가 납부 까지 하신다면 한테 전화 주시
11,한번 얘기 하시고요
12,
1,죄송합니다 지금 대출 다른 잠깐 안내 해드리라고 안내 하니라고요 고객 이제 당일 만기 상환 지금 바로 안내 드릴게요 고객 께서 지금 라는 출금 있기 고객 지금 보셨을 지금 이자 원금 납부 하시잖아요 근데 저희 전산 에는 고객 께서 이자 원금 납부 하시는 아무 의미 없는 예요 지금 DTI 초과 되셨기 고객 께서 기존 대출 받으셨다가 완납 하신 저희 전산 에는 개월 남아 있으세요 그러기 고객 께서 지금 중간 지금 만약 비행기 캐피탈 받으신 롯데 캐피탈 에서 지금 대출 받으신 지금 완납 주시잖아요 하나로 완납 주셔야 저희 에서 대출 발생 같으세요 근데 지금 부분 어려우시잖아요 어렵기 저희 당일 만기 상환 제도 라는 말씀 드리는 예요
2,당일 만기 상환 제도 무엇 이냐면요 그냥 간단하게 고객 께서 BNK PT 해서 대출 받으신 같이 쉽게 말씀드리면 하나 카드 에서 카드 으로 해서 되든 되든 됐든 대출 오늘 받으시는 예요 당사 그러면 고객 께서 대출 받으신 고객 께서 오늘 저녁 아니면 내일 오전 하나 카드 직접 전화하셔서 이든 만이 출금 고객 께서 직접 갚으시는 예요 저희 금융 이고 하나 카드 금융 이기 저희 하나 카드 고객 한테 기업 납부 증명서 요청 예요 하루 만에 대출 갚은 거지 저희 하나카드 한테 개월 동안 고객 이자 원금 납부 처럼 공문 요청 해서 공문 첨부 되면 고객 한테 사오 프로 조건 나신 승인 으로 바꿔 드린다는 말씀
3,그런데 그거 하나 카드 처럼 돼가지고 내려가는 아닌가요
4,아니죠 그러냐 고객 께서 오늘 받으셨다 갚으셨잖아요 등급 상향 되시는 예요 그리고 저희 에서도 등급 상향 시켜 드리고 고객 께서 납부 주시 지금 하나 없는데 고객 전산 임의 대로 만질 수가 없거든요 고객
5,그럼 아까 다시 돌려서 아까 갚으면 만이 나온다는
6,러시 고객
7,그럼 오늘 하나 갚으면 나오는 건가 확실한 건가
8,러시 고객 BNK 캐피탈 만약 고객 께서 갚으 신다 가정 하시면 고객 께서 고객 임의 대로 비행 케이 캐필 탈를 콜센터 전화 하시면 저희 필요한 공문 요청 받아요 그니까 저희 먼저 비행 케이 캐피탈 공문 요청 예요 고객 께서 이런 으로 해서 상환 주실 니까 비행 이키 페탈 에서는 한테 이런 공문 줘라 저희 공문 요청 다음 고객 한테 납부 주시 라고 고객 한테 요청 드릴 까요 그래요 그럼 비행 케이 캐피탈 어떻게 정리 하시겠어요 답변 하시겠어요
9,확실하게 나온다면 사과
10,그거 걱정 하실 비엔 캐릭터 BNK 피터 남아 계신
11,쳐다
12,남아 있으신 같으세요 같은 경우 다음 이자 빠져나가는 미리 선납 으로 뺀다 하고 원만 완납 처리 하시면 되는 처럼 공문 요청 놓을까요 고객 사라 러시 일단 김재성 대리 한테 공문 내려놓고요 김재성 대리 하고 다시 통화 한번 하신 다음 김재성 대리 한테 전화 드리라고 말씀 드려놓을게요 고객 알겠습니다 알겠습니다 고객
1,BNKP 채권 회수 채용 과장 입니다
2,예속 마신다 여보세요
3,말씀 하십시오
4,갚을려고 하는데요
5,
6,혹시 농협 에서 요청 받으셨는지 저기
7,고객 그럼 확인 주민 번호 자리 여섯 자리 부탁드리겠습니다 고객 으로 확인 되시는데 요요 고객 현재 저희 대출 이용 중이 신데 지금 에이치 농협 중앙회 으로
8,고객 공문 접수 돼가지고요 전산 위관 요청 이랑 기업 앞변 신명 서정 요청 드리겠습니다
9,가지 공문 들어왔고요 혹시 저희 자금 전액 상환 하시고 농협 에서 금리 대출 받아 보실려고 하시는 아니세요
10,건건 아니고요 여기 등급 빨리 해야 가지 그래 가지 일단
11,고객 에서 제출 되시는 상담사 통해 지금 신규 대출 이나 기존 대출 상환 하신 다음 이환 능력 높여서 이렇게 대출받아 보신 사례 있어서 그럽니다 그래요
12,러신 아니시고요 필수 있게 하나님
13,왜냐면 지금 요청 하신 공문 이런 사례 유사해서
14,그래요 안내 드린 거구
15,고객 아니시라고 하니까 일단 요청 주신 지금 기업 납부 증명서 하고 산이 요청 고객 저희 상환 주셔야 주셔야 그게 확인 저희
16,공문 보내 드릴 수가 있습니다 그래요 알겠습니다 상환 하신 상태 에서는 저희
17,어떻게 해야 그럼
18,일단 지금 부터 상환 절차 안내 드리겠습니다 고객 잠시 기다려 시오 여보세요 고객 지금 저희 채권 회수 으로 연락 주셨구요 지금 현재 지금 지금 중도 상환 금액
19,네모 가능하신지
20,입니다 금액 한번 불러주시겠습니까
21,
22,그리고 지금 담당 자구 납부 계좌 지금 기업은행 으로 열람 되셨구 요요 메모 가능하신지요 기업은행 고객 지금 어저께 납부 계좌 부산 은행 으로 열람 되셨는데 맞아요 고객 께서 요청 하신 저희 채권 해수 으로 납부 요청 들어오신 담당자 배정 받고 계좌 열람 드린 거구 지금 계좌 열람 시간 지금 MH 동협 에서 오전 처리 하신다고 해서 지금 밖에 열람 되세요
23,왜냐면 저희 처리
24,지금 으로 납부 주시 저희 으로 다시 한번 연락 주시겠습니까 알겠습니다 그리고 고객 납부 하실 방법 어떻게 되시나요 인터넷 거래 하면 돼요 인터 뱅이 시구 임킹 시구 납부 하실 은행 기업은행 맞아요 기업은행 이시고 지금 열람 됐으니까 납부 주시 연락 주시 납부 주셔야 됩니다
25,알겠습니다
26,감사합니다
1,저희 승인 났더라고요 금전 소비대차 계약 증서 발권 으로 진행 드릴 건데 그래서 신청 드릴 예요 그래서 공증 비용 적게는 프로 에서 프로 까지 나오더라고요 이제 신청 하면 공증 비용 얼마나 나오는지 인제 나와요 그러면 그때 인제 결정 하시면 되세요 이제 고객 승인 나셨기 프로 나오셨네요 고객 이율 나오셔서 승인 나오셨는데 심청 받으신 그래서 나오셨는데 증서 하나 붙이시면 되는 내용 이세 그래서 공증 비용 얼마 나오는지 알려 드릴 거고요 공증 비용 나중 인제 비용 나오면 어떻게 하면 비용 적게 들어가는지가 한번 한번 알려 드릴게요 왜냐면 아버님 임플란트 주신다 그래서 다른 쓰신다고도 아니고 그래서 공증 발권 비용 얼마 나오는지 정도 걸리거든요 신청 해서 이제 미용 나옴 선출 나오면 바로 전화 드릴게요
2,인증서 비용 낼신 없는데
3,전혀 없으셔서요 고객 임플란트 비용 언제 필요하시다 그랬죠 이유 이후 그러면 고객 공증 발권 제일 쉽구요 솔직히 말씀드리면 공증 발급 제일 쉬우세요 그래도 왜냐면 예전 에는 알다시피 예전 고객 연대 보증 이란 있었잖아요 근데 지금 연대 보증 제도 폐지 됐잖아요 그리고 나서 공증 발급 진행 연대 보증 제도 폐치 이후 에는 그래서 증서 발권 사실 제일 쉽구요 그다음 있는 방법 고객 이제 평점 이나 등급 등급 지금 진행 공증 발급 으로 발권 잖아요 으로 승인 건데 방법 고객 평점 높여서 진행 하는 방법 있으세요 우회 으로 그래서 어떻게 평점 높이는 예요 지금 이제 물론 통장 거래 지금 급여 같은 들어오긴 하는데 잠시 보면서 설명 드릴게요
4,고객 잠시 끊지 마세요 고객 통장 보면 지금 보면 입출금 활성화 되구 왕상 하세요 농협 통장 인제 사업 통장 이고 이제 국민회 통장 이제 급여 통장 잖아요 출근 그대로 꾸준히 있으셔서 평점 괜찮으신 약간 들어왔다 나갔다 하시는 잖아요 이런 부분 평점 높이시려면 정도 들어왔다 나갔다 이렇게 하잖아요 들어왔다 나가면 그게 만약 해서 들어왔다가 출이 되죠 그럼 으로 계산 돼요 이렇게 평점 해해 높이는 예요 순간 으로 그렇게 해서 평점 높이는 방법 있어요
5,고객
6,홍대 맞아
7,근데 고객 있으셔서 고객 넣었다가 뺐다 이렇게 하시면 좋거든요 근데 있으면 사실 임플란트 그냥 하지요
8,최근 넣었다 적이는데
9,그런 인제 그런 해서 평점 올라간 예요 고객 그런 해서 지금 평점 나온 예요 그래서 그렇게는 고객 있으면 이미 임플란트 하셨지 그러면 고객
10,넣기 강박 보증 되면
11,공증 만약 고객 없어서 공증 되시면 평점 높이는 방법 밖에 없으신 공장 공증 고객 솔직히 없어서 공증 힘드시다 말씀 잖아요 그렇죠 근데 공증 비용 있냐면 공증 예전 에는 저희 내줬어요 공증 비용 그런데 고객 들이 공증 비용 저희 내고 공증 발권 받은 다음 하다가 공증 발권 저희 받았어요 근데 대출 진행 하겠다는 고객 있었어요 저희 공증 비용 날려 버린 예요 공증 비용 내주냐면 고객 들이 대출 받아서 저희 한테 이자 내잖아요 그게 소득 있기 공증 비용 대신 납부 드렸는데 공증 발권 받고 대출 한다 버리면 저희 공증 갖고 손실 잡힌 예요 그래서 저희 바뀐 예요 정책 공증 비용 부담 으로 바뀌었어요 근데 좋냐면 고객 대출 받고 나서
1,전혀 잘못 아니요 지금 장난 하고 있는데 아시 분께는 금방 예의 않으시구나 대리 가지 마땅히 카드 이라도 적게 받았으면 받을 있는데 받은 라서
2,
3,그러면
4,시간
5,대출 한번 알아봐야 되니까
6,
7,필요하긴 경력 이구나
8,그러면 오늘 필요한 아니시고 그러시면지도 시간 있으세요 그거 고객 께서 판단 하시면 되시는 예요
9,아무래도 월요일 다시 한번 연락 주셔야 같습니다 지금 교회 나가도 준비 안될거 같아요
10,알겠습니다 그러면요 월요일 월요일 최대한 빠르게 일단 예약 으로 우선 으로 잡아 놓을 니깐 주말 동안 고객 쉬시면 드려서 한번 보시구요 그리고 월요일 회의 끝나니까 전화 드리겠습니다 오늘 수고 하셨어요
1,이역 별로 이렇게 테스트 진행 계약 하게 되는데 오늘 접수 하시게 되면은 저희 인제 수도권 기준 으로 내일 테스트 결과 보통 에서 정도 나올 예정 이구 러시 저녁 일곱 에는 저희 계약 마무리 겁니다 일단 접수 바로 들어가겠습니다 하나은행 지금 계좌 확인 되시죠 계좌 번호 불러요 주시겠어요 확인 하겠습니다 맞으시죠 비밀번호 어떻게 되시죠 시구 고객 성함 확인 부탁드립니다 생년 월일 여섯 자리 확인 부탁드릴게요 지금 이제 기사 이제 보내 드릴 텐데요 기사 보내 드릴 주소지 확인 부탁드릴게요 따로 다세대 빌라 호수 없는 건가
2,여사 한테 전화 주시 알겠습니다 중간 에서 그렇게 처리 하겠습니다 러시 아시다시피 고객 카드 현금 통장 같이 이런 금융 관련 물품 배송 금지 품목 이라 저희 이제 카드 아닌 처럼 이렇게 포장 주셔가지고 지금 저희 기사 기사 통해 저희 담당자 한테 보낼 건데 저기 박스 포장 으로 해서 카드 통장 이나 이런 부분 아닌 처럼 이제 포장 해서 보내주셔야 돼요 박스 포장 알려 드리면요 운동화 박스 혹시 있으시면 좋구요 그러세요 맞네요 그거 보다 작아도 되고 커도 상관없는데 정도 사이즈 적당해요 그래서 운동화 박스 있으시면은 운동화 박스 체크카드 이제 그네 부분 나서 아이 시티 부분 손상 되지 않도록 되게 버리실 라든가 잡지 신문 이용 하셔가지고 책갈피 으로 넣어서 상자 넣어주시구요
3,무게 너무 가볍지 않도록 의심 받지 않도록 상자 공간 신문지 넣으시거나 아니면 다른 버리실면한 책자 주변 버리실 물건 이렇게 좋구요 그런 인제 내용 채워주시면은 인제 의심 받질 않아요 일반 물품 처럼 저희 보여주기 위해 그래서 내용물 채워주시고 나서 박스 테프 상자 칭칭 감아주세요 누가 어보 않고 저희 담당자 받아서 바로 열어 보실 있게끔 고렇 박스 포장 하시는데 시간 대략 어느 정도 예상 되실까 바로 가능해요 그러세요 그러면은 포장 하신 다음 전화 통화 다시 부탁드리겠습니다 지금 사무실 지금 섭외 해야 되거든요 그냥 적수 주시고요 그냥 바로 그래 놓을게요 그러냐 인제 박스 외관 상태 라든가 아니면 내용물 무게 지금 대충 가능 이라도 잡아야지 이제 물품 들면 어떤 품목 으로 가지 접수 넣을 거든요
4,그냥 품목 없이 접수 하면 접수 받아줘요 사무실 에서 그래서 대략 으로라도 일단 포장 하시고 나서 저하 통화 다시 번만 하겠습니다 알겠습니다 감사합니다
1,지금 답답해 죽겠네 지금
2,그치
3,본인 이래 자기 성함 아니에요
4,아니요 통해 통화 했어요
5,답답하십니다 진짜
6,은행 하는 있을 있습니까
7,그니까 결과 보시 아실 예요 지금 어떤 사태 지금 발생 했는지 지금 복잡하게 됐어요 지금 굉장히
8,복잡한 경우 그거 경찰서 알아서 일이 고요 경찰 신고 해서 판출 했으면 받을 거고 에서 자기 에서 받겠죠
9,그렇죠 그거 그렇죠
10,이런 으로 완전 개떡 만들어 놓고 진짜 이런 없네요
11,지금 지금 납득 됩니다 납득 지금
12,어떻게
13,모르겠네 지금 고객 하시는 말씀 전부 거짓 이에요 지금
14,무슨 거짓 아마
15,지금 상황 상황 아닌데 지금 무슨
16,다시 한번 말씀 보세요
17,통화 하신 없으 시대 맞고요
18,아유 은행 아니라니까요 은행 고객 센터 에서 직장 연락 줬기 은행 에서 알아서 하겠죠
19,그걸 지금 은행 지금 어디 통화 하셔서 하신 예요 은행 고객 은행 아니면은 저기 반대쪽 은행
20,입금 하신 금액
21,번호 입금 하신 센터 콜센터 에서 전화 예요 그렇죠 미치겠네 지금 수가 없네 지금
22,미겠지 알었으면 어쩔 없고요 어쨌든 지금 너무나 상당한 상의 지금 범죄자 신고 되어 있는 부분 이고 어쨌든 통화 했고요 돌려 드릴 수가 없고 경찰서 통해 돌려 드릴 니까 그렇게 계세 그리고 지금 까지 통함 모두 녹취 되어 있기 에서도 신고 했으면 으로 신고 예요 계세 정신 취급 해서 이런
23,고객 지금 하시는 녹음 저희 하고 있어요
24,하고 계시 하세요
25,
26,말씀 있으세요 그리고
27,답답합니다 답답합니다
28,아니요 답답할 없어요 은행 통해 정식 으로 확인 하고 있는 부분 이기 은행 통해 이상 이렇게 처리 된다고 하면 경찰 통해 처리 거고요 에서 저리
29,또는 저희 신고 했다든지
30,통고 하세요 신고 되어 있더라고요 지금 신고 있다니까 저희 신로 신고 있더라고요
31,저희 보이스피싱 지금 당한 고요 저희
32,장난치세 지금
33,지금 비싼 먹고 지금 장난 치겠습니까 지금
34,그러게요 그래서 정강 하게 통화 했는데도 지금 그렇게 한다면 무급 신고 예요 그렇게 계시 나중 통화 할게요
1,여보세요 고객 고객 이라 분명 통화 하고 완납 서류 보내준다고 했죠 근데 고객 연락 하셨어요 하셨어요
2,알락 취하 알아봤는데 번호
3,그건 고객 께서 알아본 거지 고객 께서 잠시 번만 할게요 고객 께서 만약 알아보셨든 알아봐서 보트 피싱 이라고 하든 살기 이라고 하든 그거 고객 한테 분명 말씀드렸어요 고객 완납 받고 고객 이랑 통화 완납 보내 드린다고 근데 완납 서류 공문 이기 영수증 보내 드린다고
4,그래 영수증 이야 팔로 영수증 인데
5,그니까 하고 있잖아요 완납 있는데 완납 서류 영수증 이랑 똑같아요 고객 지금 하고 있잖아요 끊지 마시구요 들어주세요 일단 고객 이랑 대화 할려고 전화 거지 고객 이야기 들으려고 전화 아니에요 먼저 할게요 그래서 공문 공문 고객 한테 보내 드릴려고 보내 드릴려고 지금 받고 있어요 받았는데 고객 이랑 통화 완납 보내 드릴려고 고객 한테 전화 했는데 고객 전화 받으셨어요 계속 이야기 중이 기다렸어요 그래가 고객 전화 하니까 다짜고짜 남자 받으셔서 같은 이니 씨년 이니 하셨어요 애초 고객 그냥 전화 전화 피하 전화 받으셔서 이서연 대리 오늘 보겠어요 빌려지네요 그냥 완납 서류 보내 주시겠어요 그리고 원하고 그냥 한도 받을게요 했었으면 고객 완납 보내 드리고 오늘 고객 마이너스 나가셨을 예요
6,그런데 고객 다짜고짜 전화 와서 씨년 같은 이니 고객 얘기 한번 듣고 그러셨어요 고객 얘기 들으시 들으시고 다짜고짜 하셨잖아요
7,근데 여의도 지정 이라고 그래 여의도 지정 여의도 지정 민하 라고 고객 고객 믿으시든 믿으시든 어쨌든 그니까 마이너 승자 발급 나가실 거고요
8,지금 궁금한 거세
9,국민 이라고 채팅 했냐 고요
10,저희 국민은행 맞습니다 고객
11,버너 분양 없다는 아니라고 대요
12,저희 영업 기획 부구요 고객 영업 기획 제대로 알아보셨어요
13,번호 아예 없다는데요 드시죠
14,저희 지점 에서 물어보셨어요
15,여기 지절 물어보셨구나 저희 고객 일반 부서 아니라 영업 기획 부라 말씀드렸구요 영업 기획 예요 고객 은행 창구 아니라 영업 기획 예요 고객 제대로 알아보시고 한테 따지셔야지 제대로 알아보시지도 않고 다짜고짜 하시고 고객 했잖아요 고객 믿으시라고 고객 께서 다짜고짜 하시고 같은 이니 씨년 이니 어느 장단 맞출까
16,어쨌든 완납 했던 했던 붙였으니까 이랑 바음 에다가 전화하면 되는 잖아요
17,어디 바로 에다 가요
18,고객 한번 말씀드릴게요 바로 큐레 비트 상환 되셨구요 완납 서류 한테 있어요 고객 전화하시면 지금 바로 크레디트 로키 전화하시 바로 크리티 상환 됐다고 나오실 예요 완납 서류 들고 있으니까 고객 께서 지금 마이너스 고객 하신다고 하셔도 취소 처리 드릴 예요 기분 으로 고객 한테 마이너스 내어 드리고 싶지 않으니까 무슨 사인 아시겠죠 그리고 마이너스 장이 지금 취소 하면은 개월 바로 크리 디트 에서 성환 환급 되실 거구 개월 받으세요 무슨 인지 아시겠어요 재겠어 고객 그냥 계세 고객 께서 애초 믿고 진행 했으면은 고객 아무리 의심 하고 있든 하고 있든 먼저 들으셨으면은 고객 한테 이렇게 까지 그래도 고객 고객 의심 하셨구나 그래도 어떻게 말문 발급 내어 드려야지 바이 발급
19,내어 드렸을 예요 근데 고객 다짜고짜 하셨잖아요
20,라미 그땐
21,고객 하셨어요 한테 미친 사기꾼 하셨어요
22,그리고 고객 다시 했다 다음 전화 받습니다 그니
23,아니라 처음 전화했을 어떤 남자 께서 한테 뭐라고 하셨어요 경찰서 진흥 이라 고요 고객 경찰관 사관 자기 이름 밝히는 명도 없어요 고객 바꿔 준진 모르겠는데 사관 자기 이름 밝힌다는 그건 사기꾼 예요 이름 밝혀 드렸잖아요 어느 경찰관 자기 사관 찾아오라면서 건데 이름 알려줘야 찾아가죠 경차 경찰서 찾아보시면 되니 가능
24,괜찮다
25,고객 짜고짜 전화 드렸을 고객 남자 경찰관 사관 이라고 하는데 사관 아닌 이미 있구요 사관 고객 계신 이름 알려주시겠어요 진짜 경찰관 인지 한번 물어보길 모르시겠죠 정찰 안이 아니시니까 맞죠 담호 한테 같은 이니 씨년 이니 해서 오늘 마이너스 손자 고객 발급 내어 드렸어요 기분 나빠도
26,몰로 감사 아니고 전화 니까 상의 하려고
27,세요 그럼 내일 마이너스 발금 내어 드릴게요 남자 한테 지금 한테 전화해서 사과 라고 하세요 같으면 씨년 이어서 미안하다고
28,맞아요 가일 정색 맞다고요 상의 갔다 전화번호 갔었다고요
29,그럼 경찰서 가서요 한테 한테 사과 라고 하세요 그러면 그럼 내일 마이너스 발급 내어 드릴게요 오늘 영업 시간 끝났으니까 그럼 내일 마이너스 발급 내어 드릴게요 아니면 개월 환급 받으시든지
30,성격 헌거 같다는 무슨 이에요
31,개월 바로 크래스트 성환 하신 부분 개월 환급 가능하세요 지금 마이너스 통장 취소 하시면 아니면 남자 한테 가서 경찰관 이면 경찰서 가셔서 진흥 가셔서요 한테 한테 전화 바꿔주세요 경찰서 가시 한테 전화 주시겠어요 그리고 남자 한테 씨년 이라 해서 죄송하다 미에 미친 같은 이라 해서 죄송하다 한마디 하면 내일 마이너스 발급 내어 드릴게요 책임지고 마이너스 통장 내어 드릴 니까 한테 한테 사과 라고 하세요
32,거기 어딘데 지점
33,투포 여의도 본점 이라 고요 더라고요 고객 이상 이제 고객 없는 메비우스 아니고 똑같은 계속
34,그냥 여기
35,아까 영수증 보여주신다고 했잖아요 해주세요 보여 드렸냐 나주 면서 된다 했지만
36,영수증 영수증 필요 없다 했어요 완납 서류 완납 서류 예요 고객 지금 읽어 드릴게요
37,
38,입금 상환 확인 써져 있구요 확인 바로 크래 배부 차입 금액 차입 일자 상환 금액 상환 일자 상환 계좌 신한 담당자 관리 계좌 이용 용도 국민은행 경유 예시 상환 요청 서류 있어요 한테 고객 이랑 통화 하고 영수증 아니라 확실하게 완납 서류 보내 드릴려고 했어요 저가 나중 피해 보더 라도 근데 고객 남자 한테 뭐라 했어요 씨년 같은 근데 저가 이런 듣고 어떻게 고문 보내 드려요 고객 입장 바꿔서 한번 생각 해보세요 고객 이어도 전화 고객 이어도 보내주셨을 예요 그러니까 남자 한테 가서 한테 사과 라고 하세요 그럼 완납 서류 보내 드리고 마이너스 송장 내어 드릴 니까 고객 믿으시든 믿으시든 상관없어요 어쨌든 실정 고객 한테 마이너스 내주기로 했고 이렇게 예외 심사 으로 주기 했으니까
39,약속 지킬 예요
40,아니면 취소 처리 든지 아니면 메게
41,개월 받는다고요 바로크 리스트 에서 에요 지금 지금 다른 업무 되게 바빠요 지금 고객 이랑 이렇게
42,선생 만을 참기게 만나고요 거기
43,개월 받으 신다고요
44,어차피 완납 건데 다시 대출 하는 예요
