Index,Text
2,방향 간략하게 설명 한번 드릴 니까 한번 들어 보시 말씀 주시 됩니다 지금 설명 드리는 대출 자체 혼자 인제 단독 으로 진행 해서 대출 승인 처리 드릴 있는 보고 아니고 외부 전산 업체 통해 해당 금융 결제 부서 리벨이트 지급 하는 조건 으로 승인 처리 드릴 건데 쉽게 말씀 드리자면 금융 사례 컨텍 해서 금융 사의 대출 결제 주는 책임자 미리 맞춰놓고 진행 하는 대출 이라 대출 자금 프로 가능한 출이라 해서 설명 드리는 거구 기존 고객 께서 진행 하셨었던 중개 업체 처럼 여기저기 전화 받으라 하며 신용 조회 기록 남겨가며 진행 하시는 대출 아니라 전산 업체 에서 고객 한테 금융 으로 배정 주실 겁니다
3,그럼 정부 금융 본인 직접 접수 거고 접수 하시고 나면 이제 확인 나셔서 고객 통장 으로 출금 입금 까지 받으실 있도록 이제 처리 드릴 거구 보수 으로는 동안 신용 관리 도움 드릴 겁니다 그래서 관리 기간 이후 기존 고객 께서 대출받았던 산나 머니하고 리드 프랑 오케이 저축은행 군데 있잖아요 고객 군데 금리 높더라고요 니까 나머지 햇쌀론 라든가 할부 이런 건데 군데 금리 높기 군데 이번 제출 해서 군데 저희 롯데 캐피탈 에서 금리 프로 채무 통합 으로 대관 대수 드릴 겁니다 대신 금리 대관 대수 아무나 드릴 있는 아니라 신용 관리 기간 동안 에는 연체 기록 절대 하시면
4,되구요 그리고 다른 대출 알아보시면서 조회 기록 남기시면 되거든요 그래서 가지 동안 정확하게 이행 주시 저희 롯데 캐피 자리 에서 금리 프로 대반 대출 드릴 수가 있는 거구 일단 지금 생활 자금 으로 인제 나가시 출금 한해 서는 지금 설명 드린 내용 들으셨으면 고객 서도 충분히 이해 하셨겠지만 정상 방법 으로 진행 되시는 대출 아닙니다 근데 설명 드리냐면 지금 고객 상황 에서는 다른 서류 돌린다고 해서 제출 나올 있는 상황 아니기 설명 드리는 거든요 파업 으로 진행 되는 대출 이고 고객 본인 자력 으로 되는 대출 진행 하는 과정 에서 비용 따로 발생 되십니다 근데
5,발생 된다고 해서 고객 께서 본인 먼저 부담 하시라고 말씀 드리는 당연히 아니구요 일단 전산 업체 에서 선정 금융 에서 승인 나셔서 출금 입금 먼저 받아 보실 겁니다 그럼 본인 입금 받은 확인 확인 하시고 이후 전산 업체 으로 후불 제로 비용 결제 주시 되거든요 비용 같은 경우 에는 고객 그래도 다른 해서는 그나마 낮은 금액 으로 측정 되셨구요 진행 하시는 대출 금액 프로 측정 되셨구요 프로 라고 하면 전산 비용 으로 발생 된다고 생각 하시면 되거든요 프로 가능하신 처리 해서 설명 드린 거고 진행 하실 의사 있다고 하시면 오늘 안쪽 으로 성함 처리 까지 진행 도움 드릴 거구 의사 없다고 하시면 서류 안전하게 폐기 드릴 거구 고객
6,이요 어떤 였니 이요
7,그렇죠 이번 나가는 대출 해사 고객 자력 으로 대출 나가는 아니다 니까 비용 따로 들어가시는 예요 병거
8,삼삼 일만 건데
9,
10,그렇게 생각 하시면 돼요 왜냐면 있다가 금리 프로 대출 드리면은 나간 이자 자체 틀려져요 이번 그니 사출 같은 경우 에는 금리 프로 이렇게 되잖아요 번만 돌아가시는 거고요 이자 나가는 아니라 이번 나가는 대출 고객 자력 으로 대출 나가는 아니다 니까 비용 따로 들어가시는 예요
11,조금 부터 클리 하는데 언니
12,저렴한 비용 고객 생각 틀리다는 아니에요 저렴한 비용 아니지만 확실하게 프로 나갈 있는 대출 이라서 설명 드린 예요
13,사체 프로 나오죠
14,카처 그거 나중 니까 나올 수도 있고 그거 그건 진짜 나중 이자 갖다가 나중 원금 제대로 들어서 고객 선의 빼는 거고 선의 자만 떼고 나중 인제 유튜브 갖고 나가시 보시 아시 유가 원래 근데 일수 같은 그런 알아보지 않으실 그거 시간 허니 프로 빼고 나중 이자나 하루 갚는 잖아 나중 계산 하면은 이자 장난 아니에요
15,짜리 자리 검은 건데
16,아니라 이제 선의 빼는 거고 이자 계산 했잖아 그거 주문 흐인 어떻게 되세요 대법
17,서로 결하
1,화민 금융 나들목 상품 출시 만에 자금 소진 프로 이상 상태 보증 부분 저희 농협 은행 에서 추가 정부 정책 자금 으로 지원 드리는 부분 이라 고객 께서 부담 하실 수수료 보증 일정 발생 되는 부담 비용 없으세요 상담 진행 통해 대출 신청 하신 이차 으로 한국 자산 관리 공사 에서 보증 발급 까지 완료 되셔서 최종 승인 나시 고객 계시는 지역 가장 가까운 에는 지점 안내 받으셔서 방문 하시고 계약서 작성 하시면 출금 수령 가능하세요 신청 금액 기재 주셨는데 맞으신 가요 이시고 필요하신 자금 사용 목적 재원 자금 생활 자금 사업 자금 에서 어떤 목적 으로 필요하세요
2,하고 생활자 금은 그렇습니다
3,이시고 생활 자금 이시고 현재 이용 하시는 기존 대출 상품 어디서 이용 중이
4,저기 탈론 인가 그거 하나 받아 있고 캐피탈 현대 캐피탈 이자 대요 그거 하고 그랬는데
5,차량 할부 아니시고 신용 대출 받으신 건가
6,금액 얼마나 드세요
7,얼추 갚아고 남아있어요
8,최초 발생 금액 지금 얼마 정도 되시구요
9,처음 받아가지고 인자 갚았어요 갚고 인자 지금 남았는가 그럴 예요
10,지금 까지는 미치시고 정도 되시고 살롱 같은 경우 에는 금리 저희 그렇게 많이 차이는 나세요 그래서 이제 햇살 으로는 자금 으로도 나오실 수도 있는데 만약 생활 자금 으로 나오시게 되면 고객 께서 어차피 자유롭게 이용 가능하시니까 부분 상환 주시 같고요 지금 현재 직장 다니시나요 사업자 가요
11,직장 다니는데요
12,근무 하신 얼마 되셨어요
13,여기 한지 개월 됩니다
14,사제 포함 가능하실까
15,실례 지만 소득 얼마나 되세요
16,나이 많아 가지 연금 얼마 돼요 연봉 조금 넘습니다
17,연봉 으로 연봉 이상 어차피 상품 신청 되세요 그래서 이제 서민 지원 상품 이기 그러시구요 일단 직장 근무 하시고 보험 가능하시고 기존 대출 이용 하시는 그렇게 많지는 않으셔가지고 이제 한도 금미 산출 가능하신데요
18,고객 저희 농협 이용 주시 고객 맞으신 가요
19,기존 고객 이시고 거래 하신지는 얼마나 되셨어요
20,농협 의하면 그리한 오래 됐지
21,많이 오래되셨어요
22,고객 성함 알려주세요 생년 일만 말씀 부탁드릴게요 한도 금리 선출 저희 은행 전산 으로 조회 통해 고객 신용등급 이나 이제 조회 이력 영향 끼치지 않고 알아봐 드릴 건데 예상 소요 시간 에서 정도 까지 소요 되세요 통화 가능하실까
23,그때 하시죠
24,배송 가능
25,이번 번호 지금 번호 하면은 농협 으로 나와요
26,고객 관리 부서 연결 되시구요 잡으라고요
27,
28,과장 대리 입니다
29,혹시 보직 비싱 이나 대출 그거 빙자 하는 사기 같은 그런 아니죠
30,그런 아니시구요 직접 전화하셔서 확인 하셔도 무방 하세요
31,그러니까 어디 해시 농약 콜센터 바로 전화 해볼게 본사
32,알겠습니다 확인 보시구요 결과 나오는 대로 다시 한번 전화 드리도록 하겠습니다 감사합니다
1,이해 하셔 볼까 다시 한번 마지막
2,고객 만약 이렇게 결제 하시고도 나중 결과 보셨다 하시는 경우 있잖아요 그럴 저희 고객 께서 결제 하신 금액 전액 환불 처리 드린다는 예요 그래서 만약 되면 된다고 정확하게 말씀 드릴 거고 마무리 까지 고객 한테 피해 가시는 없도록 정확하게 마무리 지어 드릴 건데 고객 지금 대해 말씀드리는 이유 해도 되시는 솔직히 대부분 이에요 근데 고객 같은 경우 에는 신용 정보 수정 하게 되시면 이제 프로 이상 대출 가능하시기 말씀 드려 보는 거고 그대로 고객 정서 임의 저희 에서 조절 하기 약간 판법 으로 진행 되시는 거고 비용 조금 들어하시지만 무조건 저희 상품 주시 조건 진행 해드릴 건데 진행 하시면 진행 어떻게 되는가 먼저 설명 드려 볼게요 저희 정보 수정 진행 하게 되시면 저희 개월 동안 신용 관리 드릴 예요
3,고객 바쁘세요 절리 어떡하지
4,우선 이제 개월 에는 신문 고객 가력 으로도 이제 일반 있죠 국민은행 신한은행 우리은행 이런 에서도 신용 대출 받아 있을 만큼 등급 해야 돼요 근데 고객 께서 정보 수정 대체 저희 회사 에서 받아 보시 대출 그때 돼서 다른 에서 받아 보신다 하시면 저희 드리는 이유 없어지잖아요
5,막도
6,에는 무조건 저희 회사 상품 사용 주신다고 약속 주셔야 진행 드릴 있는 거구 하였을 경우 일단 까지 나가세요 최소 까지 나가시 여기 대한 금리 처음 에는 프로 적용 되실 예요 근데 고객 께서 개월 동안 상환 주신다 하시면 저희 고객 VIP 등급 생산 시켜 드릴 거고 그로 인해 이제 저희 금리 할인 혜택 들어가요 프로 정도 그래서 최종 으로 이제 프로 이용 있으신 예요 저희 자업 나가시는데 이제 정보 수정 필터 말씀드렸어요 저희 지금 고객 등급 자체 하루아침 지금 저희 에서 등급 확인 되시는데 고객 등급 등급 까지 만들어 드리게 되면 저희 측도 물론 이고 고객 서도 이제 감원 접발 가능성 있으세요 필터 걸리지 않는 정도 으로 계산 해서 조금씩 올려 드릴 건데 기간 정도 걸리시구요
7,이해 하신 맞으세요 수고 신경
8,수정 되신 고객 신용 정보 저희 은행 연합 전산 등재 건데 그러면은 고객 상담 등급 되시는 거고 그다음 저희 달금 이상 받아 보셨다록 처리 드릴 예요 근데 여기 중요한 개월 신용 관리 드린다고서 말씀드렸는데 사이 정도 공부 중이 생겨요 하시냐 저희 정보 수정 드리지만 지금 쓰고 계신 대출 정보 대해 저희 변경 처리 불가능합니다 그래서 일단 저희 잠금 받아 보시 상환 하실 거고 완납 하셨다고 증빙 하시면 저희 받아 이력 대해 서까지 없애 드리고 아시겠죠 회사 에서 지금 저희 갖고 계신 프로 짜리 카러 트론 같은 경우 저희 없애 드린다는 예요 그리고 저희 신용 으로 해서 이제 금액 이상 으로 저희 잠깐 받아 보신 처리 드린다는 건데 어떠세요
9,인자 전화 고로 가지 듣기 들었습니다마는 그래 갖고 요즘 병원 가야거든 필요해요
10,필요하다니 따로 필요하신 없고 일단 고객 진행 드릴 있는데 여기 대해 비용 부되 신다는 예요
11,얼마나
12,그니까 저희 평점 같은 등급 같은 고객 변경 할려면 저희 권한 받아 와야 되거든요 위해 임의 대출 건수 발생 시킬 건데 거기 대해 비용 소모 되세요 센테이지는 프로 정도
13,얼마 다시 팔더라고요 하나 팔더라 네네 금액 얼마 인데 그래요
14,일단 오늘 진행 하시는 예요 저희 최소 금액 으로 진행 거고 하시면은 정도 판도 발생 하실 예요 거기 대해 이제 비용 청구 조금 되시죠 고객 아까 필요하시다고 하신 감독 실제 정도 되시면요 그럼 저희 둘를 생산 시켜 드리게 거고 거기 대해 비용 청구 얼마 들어가실 예요
15,그냥
16,하고서 에는 에서 프로 까지 받아 있으신
17,그러세요
18,알겠습니다 그럼 행사 없으신 니까 고객 보안 유지 주세요 맛있게
19,
1,안녕하십니까 저희 신한은행 이하일 이라고 합니다 금일 저희 으로 음성 안내 메세 드리시고 마이너스 통장 상담 문의 하신 고객 아니십니까 가지 여쭤 볼게요 케이프 에서 지금 자금 받으신 금리 프로 나오셨나요 굉장히 필요 카드 이용 하시니까 카드 이용 하시는 않으시겠어요 일단 지금 자금 계획 있으신 어떠한 용도 사용 하시라고 희망 하시는 건가 그거 이자 높아서 대안 한림 그럼 자금 그럼 대만 말고 신규 자금 가량 정도 있으시면 되는 거고요 알겠습니다 저희 한번 조회 보고 결과 안내 드려 거고요 마지막 으로 본인 확인 위해 고객 성함 이랑 생년 일만 여섯 자리 확인 한번 부탁드리겠습니다 소중한 정보 감사 드리고요 저희 한번 조회 해보고 결과 나온 대로 연락 드릴 텐데 아무래도 가조 소요 되는 시간 시간 에서 주인 까지 소요 되십니다
1,이제 채무 개월 이상 쓰셔야 이제 햇살 진행 가능하시거든요
2,햇살 쓰는 어떻야 된다고
3,저희 햇살 특성 채무 개월 이상 쓰셔야 햇살 진행 가능하지 거든요 아이 이제 개월 되시는 이제 채무 있으셔서 부분 이제 문제 생기신 겁니다 고객 께서 이제 어떻게 이제 하고 이제 퍼져 저축은행 같은 경우 이제 이제 저축 이제 정리 주시 저희 자금 받아 보시 어떻겠어요 고객
4,그건 인제 개월 수가 되니까
5,이제 걸리시는 저희 어떻게 이제 고객 정리 주신다 하시 하시면 저희 에서 바로 진행 가능하시고 이제 오늘 으로 이제 바로 송금 가능하시니까
6,일단 그건 해결 해야지 된다는
7,근데 이제 하고 페퍼토츠 은행 잖아요 에서 이제 군데 이제 정리 하셔도 저희 에서 자금 나가거든요
8,아니고 만요
9,고객 같은 경우 이제 이제 군데 가지 계시잖아요 근데 이제 고객 이제 대출 받으시는 필요해서 받으시는 건데 없어서 받으시는 건데 정리 하시 기는 어려우실 아니에요 러시 니까 이제 군데 우선 정리 주시 저희 에서 자금 이미 무리 없이 나가거든요 근데 이제 이렇게 보시면은 금액 금액 이다 니까 이제 신데요 금액 잖아요 지금 이자 납부 하시고 이제 팩퍼 같은 경우 이제 원리금 균등 아예 방식 으로 이제 내시구요
10,라면 저기 걸아야 라면 갚아야지 그래 그렇지아 이자 프로 패퍼 보액 아니요 고객 그리 그러셔 봤자 어차피 이제 이제 고객 께서 갚아 버리잖아요
11,그러셔도 이제 페퍼 조칭 은행 저희 으로 오게 있어요 돼요 말씀드리는 군데 정리 하셔도 이제 폐퍼 은행 저희 으로 이제 가능하시다고 말씀 드리는 예요 이제 고객 께서 이제 이제 잠시 잖아요 만약 정말로 힘드시다 하시면 우선 과장 한테 말씀 올려서 이제 부분 너무 힘드시다 하셔서 아니면 그냥 일부 이제 변제 하시겠다 하셨다 이렇게 얘기 말씀 드릴 있으세요 러시 어떻게 고객 변제 가능하신 건가 그러면 힘들잖아 많이 힘드세요 이제 그니까 이제 일부 변제 하시면 되세요 이제 우선 먼저 일부 변제 하신 다음 에요 고객 께서 이제 연체 하시겠다 이제 저희 에서 진행 가능한 니깐
12,일부러 얼마
13,우선 지금 나오시는 부분 에서 이제 이제 먼저 이제 일부 도와주시구요 변제 주시구요 이제 변제 잠시 이제 먼저 변제 하시고 이제 그리고 고객 께서 이따가 과장 한테 지금 전화 가실 예요 그러면 그때 하시겠다 이렇게 하시면 무리 없이 무리하 무리 없이 그냥 오늘 에까지는 자금 나가시구요
14,
15,동양 피시방 어떻게 진행 드릴 까요 이렇게
16,그러면 어느 해야 돼요 이요 체람
17,페퍼 같은 경우 이제 고객 께서 잠시 페퍼 에서는 고객 께서 이미 내신 금액 있기 에요 어차피 선선 저희 대안 대안 하면 이제 상관없으니깐 이제 먼저 이제 변제 처리 하시는 제일 빠른 방법 같아요 여세 과목 했을
18,어떻게 지금 변제 가능한지 체람 체람
19,
20,정도 되는데
21,그렇죠
22,거기 이면 되잖아요
23,그렇죠
24,거든요 세람 라고요
25,한텐 아까 라고 말씀 하시지 않으셨어요
26,아니고 다른 자은 에기 UI 자모 에기 예요 섣불러 아까 얘기 같아요
27,아이유 같은 경우 라고 하셨고요 한테 그리 리드 코프 이제 태광 대불 이제 이제 페퍼 이제 새로 저축은행 아시 아니신 건가
28,세라 에요
29,이제 빌리셨어요 세라 잠시 이렇게 되시면 우선 원만 납부 하시면 되세요
30,
31,오늘 이제 납부 이제 처리 가능하세요 현재
32,
33,세라 이제 이제 처리 가능하시구요 그러면 과장 한테 이제 힘드시니까 이제 변제 하신다 이렇게 말씀 올려 드릴게요 우선 잠시 우선 고객 께서 이제 일부 변질 하시면요 저희 에서 이제 우선 한도 올라 나가실 있는 이제 의향 있으세요 기선 그러다 보니 그러다 이제 따로 우선 그거 나중 과장 이랑 얘기 하시면 되시구요 이제 법무 이제 납부 처리 이제 말씀 한번 다시 드려 드릴게요 고객 께서 이제 잠깐 저축은행 이제 대한 부서 이제 변제 진행 하실 반드시 법무 납부 증명서 이제 끊어 달라 하셔야 돼요 여보세요
34,
35,래야 그래야만 이제 당일 자금 받으실 있으시구요 저희 실수 아니면 고객 실수 부결 되실 이제 해당 금융 에서 이제 돌려 받으실 있으세요 이제 그니까 법무 납부 법무 납부 증명서 끊으실 이제 법무 비용 발생 되시는데요 저희 에서 복무 비용 면제 넣어 드렸으니까 비용 따로 내주셔도 되구요 잠시 이제 오늘 으로 바로 진행 가능하신 맞으시구요 잠시 그럼 우선 저희 에서는 법무 계좌 있고 가상 계좌 있는데요 설명 드신 여보세요 혹시 지금 통화 정말 가능하신 맞으시죠 우선 가상 계좌 처리 하시면요 고객 께서 저희 에서 부결 하시 처리 하시면요 환급 되시구요
36,이제 주문 주선 처리 들어가셔서요 이제 고객 이제 부득이 상황 오실 있으세요 그러니까 이제 법무 계좌 납부 하시면 이제 업무 으로 고객 우선 법무 계좌 받으 신다고 말씀 올려놓을게요 우선 잠시 우선 이제 사과 올려 드릴 거든요 그러시면은 이제 메모 준비 주셔야 돼요 사과 에선 그니까 이제 우선 지금 신사 올려 드리면은 시간 정도 소요 되세요 이제 전화 가시 니깐 이제 심사 전화 받아주시구요
37,계좌 번호 문자 보내주면 돼요
38,문자 저희 에서는 개인 으로 이제 문자 보내 드려요 이제 그니까 사과 에서 이제 메모 하라 하실 예요
39,
40,알겠습니다 그러면은 이제 메모 하시면 되시구요 우선 심탁 올려 드리겠습니다 담당자 이성규 였습니다
1,여보세요 사장 여기 무신 인데 저희 으로 입출금 가능한 계좌 임대 주시 저희 임대료 드리고 있는데 생각 있으세요 아닌에요 육법 이청 불법 그거 불법 든지 불법 이에요 사장 길회을 가셔다 담배 피더 라도 불법 고요 근데 하지만 선장 보안 으로 저희 진행 하잖아요 사장 으로 저희 받는 통장 받고 입출금 가능한 저희 계좌 받고 있는데 그래요 혹시 번호 연락 주시 돼요 알습
1,여보세요
2,아까 통화 도움 드렸던 담당자 에이 쓰리예요 저희 고객 지난주 도움 드렸던 안전 보안 로드 지금 제대로 되신 제대로 되셨기 다시 한번 안내 도움 드릴 건데 고객 잠깐 빠르면은 정도 안내 드릴 건데 잠깐 통화 괜찮으시겠어요
3,포알 모드
4,
5,근데 그거 저번 그거 안내 브이 쓰리 그거 그거 삭제 라고 하신 건가 고객 께서 어떤 땜문 러시 번예 언니 알겠습니다 고객
6,잠깐 고객 카카오 확인 가능하시겠습니까
7,근데 그게 지금 급한 건가 봐요
8,아니요 급한 아닌데 고객 께서 접수 드리기 해서는 지금 고객 께서 필요하시기 안내 드린 부분 인데
9,궁금해서 여쭤 보는 건데 하는 하는데 궁금해서 하는데 지금 급한 건지 궁금해서요
10,저희 고객 접수 신청 드린다고 했잖아요 근데 저희 고객 께서 계약서 관련 이라든지 공론 요청 부분 저희 고객 께서 완료 되어 있으셔야지만 고객 정상 으로 대해 진행 하시고 별다른 문제 없이 진행 가능하시기 부분 고객 께서 지난주 안내 드렸던 건데 고객 께서 지금 부분 지금 되신 같으셔서 다시 한번 고객 안내 도움 드릴려고 전화 드린 건데
11,그니까 공문서 그런 계약서 받으려면 이제 깔아야 된다고요
12,맞습니다
13,공민 서류 그냥 전화 받아야 되나요 이런 스마트폰 으로 받아야 되나요 텍스 그런 받으면 될까
14,갑자기 저희 고객 어떤 부분 지금 그러는
15,그냥 택스 마다 찾아 갖고 지금 핸드폰 약간 맛시 왔어요 아까 전화 받으려면 한참 기다려야지 전화번호 누를 있고 지금 약간 문자 보내는 약간 카톡 열무 오래 걸리고 그래 갖고 인지 넣으면 심방 면령 됐던 봐서 택스 지금 바로 있으니까 택스 받아놓으면 좋을 같은데
16,근데 저희 고객 께서 지난번 이제 핸드폰 으로 하시는 전자 계약서 진행 하신다고 하셔서 아예 먼저 등록 버렸는데 갑자기 지금 오셔서 말씀 바꾼다고 하면은 에다가 이렇게 말씀드리는 많이 난감한 부분 이기
17,그런 하죠 어머님 어떻게 하세요
18,죄송합니다 고객 미리 양해 드리구요 지난주 금요일 고객 께서 처음 말씀 하실 말씀 이렇게 어떻게 해서 어떻게 진행 하시겠다 먼저 말씀 주셨으면 예약 드렸었는데
19,지금 아직 그러면 진행 부분 없는데 지금 에도 그렇게 주시 돼요
20,이미 일단 저희 요청 드린 부분 이기 변경 하시게 되면 시간 소요 걸리실 텐데
21,저희 일단 고객
22,카톡 에다가 보내 드렸거든요 그냥 다운로드 하신 다음 완료 되시면 설치 하시고 설치 하시면은 또는 실행 버튼 눌러주시면 된다고 말씀 그때 그게 보자 그래 다운 노자 현대 캐피탈 보안 모듈 이라고 해서 전자 계약서 관련 해서 드린다고 말씀드렸구요
23,그걸 안내 해준다는 거고요 그러니까 그게 고요 정확히 다운 받는
24,보안 모델 이라고 생각 주시 되십니다
25,이야
26,
27,인가요 현대 캐피털
28,지난주 설치 하셨을 기억 나시나요
29,제하 없어졌어요
30,그거 고객 한테 말씀드렸었잖아요 고객 진행 하시고 나서 고객 께서 자금 수령 끝나시면은 부분 대해 전자 계약서 관련 해서 안내 드린다고 말씀드렸는데 알겠습니다 그때 담장 통화 설치 하고 는데 어떻 확인 수가 있어요 아예 걸려요 죄송합니다 고객 일단 한번 확인 보시겠습니까
31,지금 보내셨다고요 카톡 으로
32,카카오 한번 확인 보시겠어요
33,지금 카톡 전화 말씀 드리기 이상해 갖고 카톡 하나 확인 대로 되게 페이지 넘어가요 그래서 오래 걸리실 예요 잠시
34,괜찮습니다
35,아이디 비밀번호 이러 있어서 연락 했었는데 아무런 답변 없었다고 하시고요 그리고 외부 지금 아이템 이라서 외부 로는 이을 받고 있는데 따른 같은 없는데 외부 바로 가로 여보세요 얘기 같아서 주문 됐거든요 지금 다운 받고서는 설치 하면 되는
36,설치 버튼 누르시게 다운로드 완료 됐습니다 뜨시잖아요 그러시면은 로고 뜨실 건데 그다음 설치 하시고 설치 완료 되시면은 열기 또는 실행 버튼 있으신 누르시면 된다고 말씀드렸습니다 그럼 그렇게 할게요
37,하고 하면 되는 아닌가
38,고객 께서 통화 없이 괜찮으시겠어요
39,지금 통화 길이 어려우니까 에서 일단 여기 직원 같이 계셔 갖고 안녕 까면 되는 설치 하면 되는
40,맞습니다
41,얼마 으리 매드 입니다
42,알겠습니다 통화 많이 어려우신 같으신 설치 완료 되시면 카카오 번만 말씀 부탁드리겠습니다 그럼 하고 오나요 저희 고객 통화 끊으시면은 웨이 크레디트 에다가 공문서 요청 해서 고객 께서 전화하시면은 국문 확인 하고 이렇게 납부 처리 있도록 지금 빠른 마무리 드릴 이제 제일 중요한 고객 납부 처리 하시고 납부 했다는 법무 납부 증명서 발행 하셔야 되잖아요 그거 대해 지금 바로 요청 겁니다 고객 일단 으로 요청 하고 나서 말씀드릴 거고 설치 완료 되면 말씀 부탁드리겠습니다
43,알았습니다
44,알겠습니다
45,감사합니다
1,여보세요
2,여보세요 선생님 일단 확인 됐구요
3,선생님 일단 확인 됐고요
